url,title,publication_date,author,news
https://www.bbc.com/news/articles/c511vl9yjwwo,Netanyahu walks tightrope as US urges Gaza ceasefire deal,3 days ago,Jeremy Bowen,"If diplomats have groundhog days, when they are condemned to reliving the same 24 hours, perhaps Antony Blinken, the US secretary of state, felt a certain weariness as his jet approached the Middle East on his latest trip.  It is his eighth diplomatic tour of the region in the eight months since the Hamas attacks on Israel on 7 October last year. The politics of trying to negotiate an end to the war in Gaza and an exchange of Israeli hostages for Palestinian prisoners were already complicated.  They are more tangled than ever now that the Israeli opposition leader Benny Gantz has resigned from the war cabinet of Prime Minister Benjamin Netanyahu, along with his political ally Gadi Eisenkot. Both men are retired generals who led the Israel Defense Forces (IDF) as chiefs of staff. Without Benny Gantz, the Americans have lost their favourite contact in the cabinet. Now he’s back in opposition, Mr Gantz wants new elections - he is the pollsters’ favourite to be the next prime minister - but Mr Netanyahu is safe as long as he can preserve the coalition that gives him 64 votes in the 120-member Israeli parliament.  That depends on keeping the support of the leaders of two ultranationalist factions. They are Itamar Ben-Gvir, the national security minister, and Bezalel Smotrich, the finance minister. That is the point at which Secretary of State Blinken’s mission collides with Israeli politics. President Joe Biden believes that the time has come to end the war in Gaza.  Mr Blinken’s job is to try to make that happen. But Messrs Ben-Gvir and Smotrich have threatened to bring down the Netanyahu government if he agrees to any ceasefire until they are satisfied that Hamas has been eliminated. They are extreme Jewish nationalists, who want the war to continue until no trace of Hamas remains.  They believe that Gaza, like all the territory between the Mediterranean Sea and the River Jordan, is Jewish land that should be settled by Jews. Palestinians, they argue, could be encouraged to leave Gaza ""voluntarily"". Antony Blinken is in the Middle East to try to stop the latest ceasefire plan from going the way of all the others. Three ceasefire resolutions in the UN Security Council were vetoed by the US, but now Joe Biden is ready for a deal. On 31 May, the president made a speech urging Hamas to accept what he said was a new Israeli proposal to end the war in Gaza.  It was a three-part deal -  which has now been backed by a UN resolution  - starting with a six-week ceasefire, a ""surge"" of humanitarian aid into Gaza, and the exchange of some Israeli hostages for Palestinian prisoners.  The deal would progress to the release of all the hostages, a permanent “cessation of hostilities” and ultimately the huge job of rebuilding Gaza. Israelis should no longer fear Hamas, he said, because it was no longer able to repeat 7 October. President Biden and his advisers knew there was trouble ahead. Hamas insists it will only agree to a ceasefire that guarantees an Israeli withdrawal from Gaza and an end to the war.  The destruction and civilian death inflicted by Israel in Nuseirat refugee camp in Gaza during the raid to free four hostages last week can only have strengthened that resolve. The Hamas-run health authorities in Gaza say that 274 Palestinians were killed during the raid. The IDF says the number was less than 100. Mr Biden also recognised that some powerful forces in Israel would object.  ""I've urged the leadership in Israel to stand behind this deal,"" he said in the speech. ""Regardless of whatever pressure comes."" The pressure came quickly, from Messrs Ben Gvir and Smotrich. They are senior government ministers, viscerally opposed to the deal that Joe Biden presented. It made no difference to them that the deal was approved by the war cabinet, as they are not members.  As expected, they threatened to topple the Netanyahu coalition if he agreed to the deal. Neither Hamas nor Israel have publicly committed to the deal that President Biden laid out.  He accepted that the language of parts of it needed to be finalised. The ambiguity in parts of the proposal might in other conflicts, between other belligerents, allow room for diplomatic manoeuvre. But that would require a shared realisation that the time had come to make a deal, that more war would not bring any benefit. There is no sign that the Hamas leader in Gaza, Yahya Sinwar, is at that point. He seems determined to stick the course he has followed since 7 October.  Some reports out of Gaza said that Palestinians in the ruins of Nuseirat camp were swearing at Hamas as well as Israel for disregarding their lives.  The BBC cannot confirm that, as like other international news organisations it is not allowed by Israel and Egypt to enter Gaza, except under rare and highly supervised trips with the Israeli military. It seems clear though, that vast numbers of Palestinian dead have strengthened, not weakened the resilience of Hamas. For them, survival of their group and its leaders equals victory.  They will focus on the fact that the killing of more than 37,000 Palestinians, mostly civilians – according to the health ministry in Gaza – have brought Israel into deep disrepute.  It faces a case alleging genocide at the International Court of Justice, and applications at the International Criminal Court for arrest warrants for Benjamin Netanyahu and Israel’s Defence Minister Yoav Gallant. On the Israeli side, Prime Minister Netanyahu has lost two members of the war cabinet, Messrs Gantz and Eisenkot, who wanted a pause in the war to allow negotiations to free hostages. He is more exposed, without the political insulation they provided, to the hardliners, Messrs Ben-Gvir and Smotrich. Perhaps Antony Blinken will urge him to call their bluff, to make the deal and satisfy millions of Israelis who want the hostages back before more of them are killed.  Mr Netanyahu might then have no choice other than to risk his government by gambling on an election.  Defeat will bring forward commissions of enquiry that will examine whether he bears responsibility for the political, intelligence and military failures that allowed Hamas to break into Israel eight months ago. Or Benjamin Netanyahu might default to the techniques of procrastination and propaganda that he has perfected over all his years as Israel’s longest-serving prime minister.  If in doubt, play for time, and push arguments harder than ever.  On 24 July, he will return to one of his favourite pulpits, when he addresses a joint session of the US Congress in Washington DC.  Something better, for him, might emerge."
https://www.bbc.com/news/articles/c4nnr9945vmo,Guilty on all charges. Will Hunter Biden go to prison?,2 days ago,Bernd Debusmann Jr and Brandon Drenon,"Hunter Biden has been found guilty on all charges related to his drug use and gun possession, making him the first child of a sitting president to be a convicted of a crime.  President Joe Biden's son now awaits sentencing - the maximum he could receive is 25 years in prison, though experts say such a term is very unlikely. Here's what we know about the historic case and what happens next.  If Biden is given a prison sentence, legal experts said that it is very unlikely he would face the maximum 25 years for the three gun charges. Even for the charge of being an illegal drug user in possession of a gun, which carries a maximum 10 year penalty, few believe that Biden will face the full potential punishment.  South Texas College of Law Houston professor Dru Stevenson said it would be ""bizarre and unprecedented” if Biden was to receive anything close to five years. “That’s for people that [are] really dangerous, like someone who had already been on the FBI’s watchlist,” he said. Prof Stevenson said there was a “50:50 chance” of a prison term, and that he would expect something closer to 20 months. “It’s hard to predict, but I think it’s very possible,” he said. Prof Stevenson said it was also possible that Biden gets probation, rather than prison.  Biden’s apparent recovery from drug abuse may also be cited by his legal team to merit a lighter sentence. However, he noted that the judge overseeing the case had declined to give Biden’s lawyers “any breaks” during the trial. Judge Maryellen Noreika was tough on Biden’s lawyers during evidentiary hearings, the Texas professor said, and she frequently ruled against defence lawyers’ requests. That could indicate that Biden might face a harsher sentence than most would consider typical.  Judge Maryellen Noreika is expected to schedule a sentencing hearing in the next few weeks. Biden will also meet probation officers for a pre-sentencing report to be used by the judge. In the interim, it is unlikely that he will be held in custody.  Even in the event of a prison sentence, it is not expected that Biden would have to surrender to authorities immediately.  Rather, he would probably be given a date to turn himself in. Former US Assistant Attorney Neama Rahmani told the BBC that after sentencing, Biden's team will have 30 days to appeal, something Mr Rahmani said was very likely. ""This is a case made for appeal,"" he said.  He added that sending Biden to prison would be a ""logistical nightmare"" because of the Secret Service protection he gets as the president's son.  Biden faced three federal charges in the case: two counts of making false statements and one of illegal gun possession.  The charges all relate to his purchase of a revolver at a Delaware gun store on 12 October 2018, which he kept for about 11 days. By Biden's own admission, he was deep in the throes of a ""full-blown addiction"" to crack cocaine at the time. The two false statement charges stemmed from allegations that he lied about his drug use on a federally mandated form when he bought the weapon. The third count was related to his possession of a firearm while using drugs. Before the guilty verdict, President Biden said he would not pardon his son.  When asked in an interview with ABC News if he would rule out the option, he said: ""Yes."" After the verdict he appears to be sticking to the same message.  On Tuesday, he said in a statement: ""I will accept the outcome of this case and will continue to respect the judicial process as Hunter considers an appeal.""  To convict Mr Biden, prosecutors had to convince jurors that he knowingly made false statements on the form in a bid to deceive the store that sold him the pistol.  Prosecutors relied on deeply personal text messages and other communications made while Mr Biden was in the throes of addiction to prove he was a drug user when he took possession of the gun.  In one such message sent to Hallie Biden a day after the gun was purchased, Biden says he was on his way to meet a dealer named Mookie. Ms Biden, who was called to testify by prosecutors, told the court that the text had meant ""he was buying crack cocaine"". Other witnesses called to the stand were Mr Biden's ex-wife, Kathleen Buhle, and ex-girlfriend Zoe Kestan, who both spoke about his addiction.  Prosecutors have also pointed to Biden's own 2021 memoir, in which he detailed his experiences as a drug user who was ""up twenty-four hours a day, smoking every 15 minutes, seven days a week"". ""All my energy revolved around smoking drugs and making arrangements to buy drugs - feeding the beast,"" he wrote in the book.  While Biden has himself been quiet about the trial, his lawyers focused on how much he was aware of his addiction at the end of the purchase, and on the quality of the evidence itself. When questioning Hallie Biden, defence lawyer Abbe Lowell also sought to cast doubt on whether his client was seen using drugs on the day of the purchase or around it.   The third charge, regarding Mr Biden's alleged possession of a firearm while a drug user, is considered unusual, as it can be hard to prove someone is a drug user and has a gun.  ""It's just really rare that they would go after someone and prosecute them for this,"" Prof Stevenson said. ""But this is a high-profile person and there's been members of Congress demanding he be prosecuted."" Among the most prominent pieces of evidence at the trial is the information on Biden's infamous laptop, which has been the focus of intense media speculation and focus from conservative news outlets.  The laptop contained the text messages and pictures sent and received by Biden around the date of the firearm purchase, which prosecutors argue are evidence of his guilt.  Biden's own lawyers have argued that the computer was tampered with before it fell into the hands of investigators.  Erika Jensen, an FBI agent who was called as a witness to testify about the laptop's contents, confirmed its authenticity to jurors.  The special counsel appointed to oversee the probes into Hunter Biden, David Weiss, has said that the tampering argument is a ""conspiracy theory"" with ""no supporting evidence"". The laptop has also been at the centre of unproven theories linking Biden and his father to corruption, which they both deny.  In addition to the gun charges in Delaware, Biden is facing separate federal charges in California over allegations that he evaded a tax assessment, failed to properly file and pay taxes and filed a fraudulent tax return. Several months after the spectacular collapse of a plea deal that would address both sets of charges last year, Biden also  pleaded not guilty  to the tax charges."
https://www.bbc.com/news/articles/cy00gykj13zo,Kevin Spacey says he was 'too handsy’ in the past,2 days ago,Ian Aikman,"Actor Kevin Spacey has described himself as ""being too handsy"" in the past, in a new interview. Speaking with Piers Morgan, the 64-year-old admitted to ""pushing the boundaries"" in reference to allegations of inappropriate behaviour that brought his career to a halt in 2017. Last year, the actor was  found not guilty of all charges of sexual assault  against four men between 2001 and 2013 after a trial in London, and in 2022 a US court  dismissed a sexual assault lawsuit  against him. Spacey is currently  involved in a civil trial over an allegation , which he denies, that he sexually assaulted a man in 2008.  Mr Spacey said his home in Baltimore, where he has lived since 2016, is being foreclosed and sold at auction because he cannot afford to pay the ""many millions"" he owes in legal bills.  The interview, broadcast on the Piers Morgan Uncensored YouTube channel, featured a direct discussion of how Mr Spacey views his past behaviour.  When asked to clarify what he meant by ""pushing the boundaries"", the double Oscar winner said: ""Being too handsy, touching someone sexually in a way that I didn't know at the time they didn't want."" Pressed on the potential for this being criminal conduct, Mr Spacey said he has ""been gentle with people"" and he would not use the word ""grope"" to describe his actions.   ""You want to be gentle. You want to see if they're going to respond positively,"" he added. Mr Morgan asked him: “Would you say all of that was consensual or was it an attempt at seduction, that if it was repelled, by definition becomes I guess non-consensual, that if you're being handsy, if you're groping people, and they don't want to do it …” To which Mr Spacey replied: “… then they should let you know they don't want to do it so that you can understand it's non-consensual and stop.” Asked if he could understand that a young actor might worry that someone with his influence could damage their career if they rejected his advances, Mr Spacey said: ""Yes"".  The actor said that he is ready to ""take accountability"" for some of his past actions, which he describes as ""bad, bad, bad behaviour"".  But he also said that ""a whole lot of people"" have made false claims against him.   In May, Mr Spacey  denied fresh allegations against him  which aired in the Channel 4 documentary Spacey Unmasked.  Actors Ruari Cannon and Danny De Lillo both alleged inappropriate behaviour by Mr Spacey in the documentary. Mr Cannon alleged that Mr Spacey touched him inappropriately in public at a press night for an Old Vic theatre production in 2013. Mr Spacey said the allegation was ""ridiculous and it never happened"". Mr De Lillo alleged the actor thrust his groin towards his face while he was seated at a production at the same theatre. Mr Spacey said he found the accusation ""completely offensive"". After the documentary was broadcast, a group of Hollywood stars including Sharon Stone, Stephen Fry and Liam Neeson called for Mr Spacey  to be allowed to return to acting .  Speaking to the Telegraph, Ms Stone said: ""I can't wait to see Kevin back at work. He is a genius."" Mr Spacey won the Oscar for best actor for American Beauty in 2000, and for best supporting actor for The Usual Suspects in 1995. He was also the artistic director at the Old Vic Theatre in London between 2004 and 2015. In a statement, the Old Vic said it had conducted an investigation in 2017 into alleged inappropriate conduct by Mr Spacey at the theatre between 2005 and 2013. It said there were ""no findings of fact"" regarding the actor's alleged misconduct, and  no evidence of formal complaints against him.  Mr Spacey was sacked while filming the Netflix series House of Cards after the first allegations against him emerged in 2017.  His scenes from the then-upcoming Ridley Scott film All the Money in the World were erased and reshot with Canadian actor Christopher Plummer replacing him."
https://www.bbc.com/news/articles/c1vv6p9k1z1o,US lifts weapons ban on Ukraine's Azov brigade,2 days ago,Jaroslav Lukiv,"The US has lifted its long-standing ban on weapons supplies and training to Ukraine's Azov brigade, whose origins were mired in controversy over alleged links to far-right groups. A state department spokesman told the BBC a vetting process ""found no evidence of gross violations of human rights"" by the brigade.  The Azov brigade, now a unit within Ukraine's National Guard, hailed the move, saying Russia's ""lies... received a devastating blow"". Moscow condemned the decision, with Kremlin spokesman Dmitry Peskov saying the US was ""even prepared to flirt with neo-Nazis"" to suppress Russia. Russian President Vladimir Putin has repeatedly made false claims about a ""neo-Nazi regime"" in Kyiv to try to justify first the annexation of Ukraine's southern Crimea peninsula and backing of pro-Moscow fighters in the east in 2014, and then his full-scale invasion launched in 2022. Speaking on the condition of anonymity, the state department spokesman told the BBC that Washington applied a vetting process to the National Guard of Ukraine's 12th Special Forces Azov Brigade and ""found no evidence of gross violations of human rights committed"". ""Russian disinformation attempts to conflate Ukraine's National Guard Unit of 12th Special Forces Brigade Azov with a militia formed to defend Ukraine against Russia's invasion in 2014, called the 'Azov Battalion',"" the spokesman added. Under America's ""Leahy Law"", sponsored in 1997 by then-Senator Patrick Leahy, a finding that a foreign military unit has committed gross violations of human rights means it can be cut off from US military assistance. The US government says it considers torture, extrajudicial killing, enforced disappearance and rape as such types of violations when implementing the law. Reacting to the US decision, the Azov brigade said in a statement: ""The lies about Azov, which the Kremlin regime have been spreading in the West for years, received a devastating blow today. ""Receiving Western weapons and training from the US will not only increase the combat capability of Azov, but most importantly, will contribute to the preservation of the lives and health of the personnel of the brigade."" A volunteer militia battalion called Azov was originally set up in May 2014 to fight Russian-backed forces in Ukraine's eastern Donbas region. Later that year it was briefly incorporated as a separate regiment in Ukraine's interior ministry before being transferred to the National Guard.  Some members of the original battalion were reported to have had links to far-right and ultra-nationalist groups at the time - but a number of them, including the first commander, later left the unit.  The US banned the regiment from receiving US weapons for the alleged links to the far right.  In 2016, a UN report accused the Azov regiment of ""looting of civilian property, leading to displacement"" in eastern Ukraine. The current leadership of the Azov brigade says its members have no ties to far-right organisations or any other extremist groups - a claim that has not been independently verified. Azov fighters are seen by many in Ukraine as national heroes for defending for months the southern city of Mariupol from a brutal Russian assault.  The port on the Sea of Azov was eventually taken by Moscow in May 2022. Many Azov soldiers are still being held by Russia as prisoners of war, amid accusations that the Ukrainians have been subjected to torture in captivity."
https://www.bbc.com/news/articles/cj7793exd15o,US hot dog contest can't stomach champ's vegan deal,2 days ago,Max Matza,"Competitive eating star Joey ""Jaws"" Chestnut has been told he cannot join America's premiere hot dog contest after striking a deal with a vegan brand.  His removal from next month's Nathan's Hot Dog Eating Contest in New York came after he agreed sponsorship from Impossible Foods, a vegan hot dog maker in competition with the Nathan's brand. ""We are devastated to learn that Joey Chestnut has chosen to represent a rival brand that sells plant-based hot dogs rather than competing in the 2024 Nathan’s Famous Fourth of July Hot Dog Eating Contest,"" Major League Eating (MLE) said on Tuesday. MLE added that Mr Chestnut was welcome to rejoin the competition, but only if he dropped his vegan sponsorship. ""Joey Chestnut is an American hero. We would love nothing more than to have him at the Nathan’s Famous International Hot Dog Eating Contest,"" the statement said.  ""We hope he returns when he is not representing a rival brand."" Mr Chestnut has won the Nathan's contest, which is televised in the US, 16 times. The rules of the contest, which is attended by some 40,000 people annually, require competitors to eat as many hot dogs (and buns) as they can in the span of 10 minutes.  Mr Chestnut, 40, holds the world record for hot dog eating, having scoffed a whopping 76 at the 2021 contest.  He also holds a variety of other  eating records , including downing 141 hard-boiled eggs in eight minutes, 23 meat pies in 10 minutes, 182 chicken wings in 30 minutes, and 25.5 ice cream sandwiches, also known as choc ices, in six minutes. Mr Chestnut said on social media he was ""gutted"", when he learned of the ban, adding he had ""been training to defend [his] title"".  ""To set the record straight, I do not have a contract with MLE or Nathans and they are looking to change the rules from past years as it relates to other partners I can work with,"" he said.  MLE said it and Nathan's ""went to great lengths"" to accommodate Joey, but that it seemed he and his managers ""prioritised a new partnership"". The Fourth of July competition has taken place every year since Polish immigrant Nathan Handwerker opened his stand on Coney Island in 1916. The story goes that on 4 July 1916 - the year Nathan's Famous Hot Dogs was founded - four European immigrants were arguing about who among them was more American. They decided to settle it with a hot dog eating contest. However, the true origins of the contest  remain shrouded in mystery ."
