url,title,publication_date,author,news
https://www.bbc.com/news/articles/clwwz7rlgrgo,What son's conviction means for President Biden,2 days ago,Anthony Zurcher,"Hunter Biden’s conviction for lying about his drug use on a handgun licence application will be a devastating personal blow for his father, Joe Biden.  The US president doubles as the patriarch of a tight-knit family that has seen its share of personal tragedy and trauma. Now his surviving son has been found guilty of three federal crimes that carry a potentially lengthy prison term. But Hunter's verdict is unlikely to change how Americans vote in November's election. His father's name will be on the ballot, not his. There's no evidence connecting the president to his son's offences. And there has been scant polling evidence that the  public is following this trial closely. After the verdict was announced, the president released a statement hinting at the dual obligations demanding his attention. “I am the president, but I am also a dad,” he said. He added that he continued to support his son and was proud of the man he is today. At the start of the trial, Joe Biden said he wouldn’t comment on the proceedings, but his son’s courtroom drama has followed him for weeks, as he conducted his official duties and campaigned for re-election. Hunter's yet-to-be determined punishment may be similarly distracting as the president prepares later this month for a pivotal presidential debate. ""This will, of course, be a personal distraction for the president, as it would be for any father,"" says Michael LaRosa, who served as press secretary for First Lady Jill Biden during the first two years of the Biden presidency. ""It's not a distraction from his duties as president, but I'm sure it will take an emotional toll on the family."" While in France for D-Day commemorations last week, President Biden said that he would not consider using his authority to pardon his son. And he added that he would accept the jury’s verdict – a contrast from Donald Trump’s rejection of his own conviction as rigged and corrupt. The former president’s response to the Hunter Biden verdict was also markedly different. In a statement released by the campaign, Trump said the trial was “nothing more than a distraction” from what he asserted were more serious crimes committed by the Biden family. That was a sentiment echoed by many other Republicans. Congresswoman Nancy Mace of South Carolina said the verdict was just “the veil of fairness”.  Others noted that the trial only went ahead because a federal judge last year rejected what critics saw as a ""sweetheart"" plea deal. Trump’s trial became a partisan brawl from start to finish, with Republican officials lining up behind the former president to condemn the proceedings. Hunter’s conviction had a different feel, marking the culmination of a dark period for a Biden family that has known more than its share of turmoil. Hunter Biden spiralled into drug use around the time that his brother, Beau, died from brain cancer. His battles with addiction and the toll it exacted on his family relationships were presented in painful detail during the trial through excerpts from Hunter’s memoir, his text messages and emails, photographs and testimony from those close to him. All the while, friends and members of Hunter Biden’s family – including First Lady Jill Biden and his wife, Melissa Cohen Biden – sat behind him, watched and sometimes hugged him or held his hand during breaks in the trial. His half-sister Ashley cried during the defence attorney’s closing arguments. “Jill and I will always be there for Hunter and the rest of our family with our love and support,” President Biden’s post-verdict statement concluded. “Nothing will ever change that.” The prosecuting attorney during his closing argument said the evidence presented was ugly and personal. He also said that it was overwhelming and it was necessary to show that when Hunter Biden filled out the federal background check application for a handgun, he knowingly lied when he certified that he was not using drugs. In the end, a unanimous jury agreed. This guilty verdict means the president’s son - the only surviving child from his first wife, who was killed along with his infant daughter in a car accident half a century ago – may face years in prison. Hunter Biden now awaits sentencing for his conviction, but even after the judge decides his punishment his legal travails will not be over. He is also facing a September trial on charges of failing to pay $1.4m in federal income taxes. That trial, coming less than two months before the election, may not contain the raw emotion on display in the Delaware courtroom, but it could prove more politically damaging for the president. Hunter’s foreign business dealings and his financial ties to the president have been a source of continued scrutiny by Mr Biden’s Republican critics. Drug addiction and the consequences of it have touched many American lives. Allegations of financial impropriety and tax fraud, however, may generate less sympathy from the voting public."
https://www.bbc.com/news/articles/crggk5rvqd1o,Tesla pay fight tests power of Elon Musk's mystique ,2 days ago,Natalie Sherman,"In 2018, Tesla shareholders approved the biggest pay package in history for Elon Musk. Six years later, will they do it again? The electric car company will find out this week at its annual meeting, where it is seeking a show of support for the roughly $50bn deal. The package - worth an estimated 300 times what the top-earning boss in the US made last year - won backing from 73% of shareholders who voted six years ago. The compensation plan gives Mr Musk rights to roughly 300 million shares  – a roughly 10% stake in the firm - as a reward for the firm meeting goals once considered laughable, like becoming a $650bn firm. But earlier this year, a Delaware judge voided the deal after a small investor sued, ruling that the sum was ""unfair"" and the process for determining the package, by a board dominated by Mr Musk, was ""deeply flawed"". Instead of backing down, Tesla said it would submit the deal to another vote - and seek to reincorporate the company outside of Delaware - calling the decision ""fundamentally unfair, and inconsistent with the will of the stockholders"". Tesla says the targets were ambitious and the compensation is essential to keep the billionaire engaged. ""We must stand by our deal,"" board chair Robyn Denholm wrote to shareholders this month. Presented to the world six years ago, the pay deal stirred debate, but few doubted Mr Musk's importance to Tesla's future.  This time, however, the fight is raising tough questions about his leadership, at a time when Tesla's shares have dropped sharply from their highs and its commanding lead of the electric car industry is under pressure. Mr Musk has been faulted for alienating potential buyers with controversial political musings and accused of diverting attention – and resources – to his other companies, including social media site X, formerly Twitter, which he purchased in 2022. “If this was back in 2018, I would have voted yes, but today, after everything that has happened, I voted no,” says investor Ven Kolli, an IT consultant from Colorado, who owns one of the company's cars and first purchased Tesla stock nearly a decade ago.  Though the 42-year-old expects the deal to pass, he hopes a tough vote will send a message to Tesla's board, which for years has faced concerns that it does not exert sufficient oversight of Mr Musk. He is not worried about losing Mr Musk, believing Tesla has gotten to a point where it can succeed without him. ""Since the Twitter acquisition closed, a lot of the decisions made specifically by Elon Musk have been very questionable,"" he says. ""Ultimately, while he's CEO, his responsibility is to Tesla and I think the board has lost sight of that,"" he says. ""It’s my opportunity to let my voice be heard, as small as it may be."" Legal experts say it is not clear if the court will accept the re-vote, which is not binding, and allow the company to restore the pay package. At least one shareholder has sued over the company's move already. But Tesla appears to be hoping that a resounding victory will help as its legal fight continues, says Ann Lipton, law professor at Tulane University. ""If shareholders overwhelmingly approve the pay package then Musk is hoping, and maybe he’s right, that the court will think twice about overturning it again,"" she says. With the vote nearing, Mr Musk and the company have pressed their case with a barrage of messages and television appearances, even announcing a lottery for shareholders for a Musk-led tour of its Texas factory.  Mr Musk has stoked the drama on social media, celebrating investors who have voted in favour, while reproaching opponents as “oathbreakers”. The entrepreneur, who already owns about 13% of the firm, has also raised the spectre of leaving Tesla unless he receives a bigger stake.  But keeping Mr Musk may be a less compelling argument than it once was, says Steve Westly, founder of the Westly Group, an early Tesla backer. “Elon is a unique visionary …but I don’t know if that means he’s essential to be running any or all of those companies today,” says Mr Westly, who no longer owns shares. ""No one stays on top forever, especially when you’re trying to lead seven companies at once.”  Those against the deal include the shareholder advisory companies ISS and Glass-Lewis, as well as several major government-affiliated investors, among them Norges Bank, which manages Norway's pension fund and is one of the Tesla's 10 biggest backers. Prominent Tesla investors such as Ron Baron and Cathie Wood, as well as established firms such as Scottish Mortgage Investment Trust are among those voicing support.  The trust, which owns about 3.1 million shares, says it backed the deal in 2018 because ""it introduced extremely stretching targets that would make a huge amount of money for shareholders if they were reached"".  ""Having agreed to that, we believe that it should be paid out."" Executive pay packages at major firms are typically approved with some 90% of the votes. Though the deal may not meet that threshold, analysts give it a good chance of passing, especially if Mr Musk's efforts to whip up support among his large public fan base are successful.  Retail investors, as opposed to professional firms, own more than 40% of Tesla's shares, an unusually high figure, reflecting the company's popular appeal. Some say their enthusiasm has diminished. “There’s been a lot of distractions that don’t relate to advancing the brand and making better cars and I feel like that should be the focus,” says Kheirallah Ashkar, a 28-year-old engineer in Washington DC, who first invested in the firm in 2020. “He’s done a fine job but I don’t think good enough to validate the crazy money they’re asking us to give him.” But on the eToro share trading platform, where Tesla has long been one of the most popular stocks, 97% of the votes cast have been in favour of the plan. Almost a third of the roughly 2 million shares held on the platform have voted, an unusually high number. ""We were pleasantly surprised by the size of the participation but I don't think we were surprised by the direction of the vote,"" says eToro chief executive Yoni Assia.   ""We have a lot of Tesla fans on eToro and a lot of Elon fans... It will be very interesting to see the results of the vote."""
https://www.bbc.com/news/articles/c6pp08q513do,Biden vows to respect guilty verdict in son's gun trial,2 days ago,Bernd Debusmann Jr,"US President Joe Biden has said he will respect a jury’s decision to find his son guilty of gun crimes, after a week-long trial that laid bare a tumultuous time for the family. The 12-person jury found Hunter Biden, 54, guilty of lying about his drug use on a form while purchasing a handgun in 2018. He faces possible jail time following the verdict, which marked the first criminal prosecution of a sitting president’s child. His conviction on all three felony counts comes as President Biden campaigns for re-election in November, and less than two weeks after his election rival Donald Trump was himself convicted of a crime in New York. While President Biden did not attend the trial in Delaware, many family members including First Lady Jill Biden did so regularly. Hunter Biden’s wife, sister and uncle were all present at times to support him during proceedings. President Biden flew to Wilmington, Delaware, after the verdict where he greeted and hugged his son on the tarmac. “I am the president, but I am also a dad. Jill and I love our son, and we are so proud of the man he is today,” he said in a statement. Mr Biden added that he would “accept the outcome of this case and… continue to respect the judicial process as Hunter considers an appeal”. President Biden earlier ruled out pardoning his son, whose trial aired embarrassing details as prosecutors sought to show he was using crack cocaine at the time he bought the gun.  Jurors heard from his ex-wife, Kathleen Buhle, and a former girlfriend, Zoe Kestan, who described frequent drug binges that took a toll on his friends and family. Text messages detailing his addiction and photographs, some showing a half-naked Hunter Biden, were also shown to the court. The verdict on Tuesday prompted instant political reaction, including from Republicans in Congress who have spent years investigating Hunter Biden’s behaviour and business ties.  James Comer, the Republican chair of the House oversight committee, said it marked a “step toward accountability”, but added that ""everyone involved"" in what he called the ""Bidens’ corrupt influence peddling schemes” should be investigated. A statement from the Trump campaign, meanwhile, said the trial had “been nothing more than a distraction from the real crimes of the Biden Crime Family”. The former president has often used that description of the family on the campaign trail, referring to  allegations of improper conduct  made against the president and his son by Republicans. Democrats in Congress accused their Republican colleagues of hypocrisy, and praised the US justice system.  “Compare and contrast the difference in reaction between the Republicans and the Democrats,"" Maryland Democrat Jamie Raskin said in a hearing.  Referring to Trump's criminal conviction, he said: ""The Republicans are attacking our entire system of justice and the rule of law because they don’t like the way one case came out, whereas the son of the president of the United States is prosecuted and I don’t hear a single Democrat crying foul.” Meanwhile, several jurors who convicted Hunter Biden have said politics was not a factor in their decision.  ""I was never thinking of President Joe Biden,"" one juror told the BBC. ""Out of all the jurors, nobody mentioned anything about political motivations,"" he added. Aides to President Biden have told US news outlets that the trial and verdict have taken an emotional toll on Mr Biden, who has been closely watching the case. Politico reported that Mr Biden had been ""consumed with the trial for weeks"" and asked family members for updates while he was on a trip to France for D-Day anniversary events. The outlet also said Mr Biden has at times felt guilty about the spotlight that has been placed on his son, and believes his political career has contributed to his son's legal problems.  According to the Washington Post , the president's advisers have often been reluctant to speak to him about his son and some have tried to limit Hunter Biden's public appearances. Hunter Biden will be sentenced at some point in the next 120 days, but the judge overseeing the case has not set a date for the hearing. He faces up to 25 years in prison, but legal experts say it is highly unlikely the eventual sentence will be close to that given he is a first time, non-violent offender. His legal issues are set to continue throughout the year, and throughout his father's election campaign. In September, he will face trial in California on charges of failing to pay $1.4m (£1.1m) in income taxes. If convicted in that case, Hunter Biden could face up to 17 years in prison."
https://www.bbc.com/news/articles/cjqqnwnqnxko,Hunter Biden jurors say politics did not sway verdict,2 days ago,Bernd Debusmann Jr & Ana Faguy,"Jurors who convicted Hunter Biden of gun crimes on Tuesday have said they did not think about his father or politics when reaching their decision. ""I was never thinking of President Joe Biden,"" one juror told the BBC shortly after the verdict, adding that their 11 fellow jurors considered it “important” to separate the facts of the case from the family. ""Out of all the jurors, nobody mentioned anything about political motivations,” the male juror, who asked to remain anonymous, said. “Somehow, you block that out of your mind."" The verdict has prompted much political reaction, with congressional Republicans who investigated Hunter Biden for years welcoming the decision. Democrats have insisted it will not affect the president’s re-election campaign. In a brief interview, the juror told the BBC he had not considered whether it would impact November’s election. Two other jurors, meanwhile, told CNN that they did not feel any pressure during deliberations, despite the high-profile nature of the trial, during an election year. One of those jurors told CNN she anticipated the panel would be ""at each other's throats because [Biden's] father is the president and because of the political climate"", but after deliberations started, she ""didn't feel pressure"".  Jurors who spoke to other news outlets repeatedly said politics did not sway their decision, but some did have qualms about the case.  One juror told CNN the case ""seemed like a waste of taxpayer dollars"", while another juror said the process was “a little bit frustrating because it felt like we couldn’t get the full story"". Despite those frustrations, the jury was able to reach a verdict within just three hours of the week-long trial. The juror who spoke to the BBC left the case with some remorse, noting that Mr Biden is not just the US president but also a dad and ""someone just convicted [his son] in federal court"".  Biden became the first son of a sitting US president to be criminally convicted on Tuesday when the jury found him guilty of  lying about his drug use  on a federal form when purchasing a handgun in 2018.  Before the case went to trial, he pleaded not guilty to the charges, claiming he did not lie on the form because he was in recovery from drug addition at the time.  Biden was stoic during the verdict reading. He hugged family members and his legal team after  he learned his fate . He will be sentenced at some point in the next 120 days, but the judge overseeing the case did not set a date."
https://www.bbc.com/news/articles/cv225l8l7jzo,Hamas seeks 'complete halt' to war in Gaza proposal response,2 days ago,Matt Murphy,"Hamas says it has submitted its response to a US-backed plan for a ceasefire in Gaza, with a senior group official telling the BBC that it still requires an Israeli commitment to a permanent ceasefire.  In a statement, the group, and its Palestinian Islamic Jihad (PIJ) allies, expressed ""readiness to positively"" reach a deal.  The proposed ceasefire plan - which was endorsed by the UN security council on Monday night - calls for a six-week ceasefire that would eventually become permanent.  Qatar and Egypt - who, along with the US, have mediated negotiations between Israel and Hamas - confirmed that the Palestinian group had submitted its reply.  In its statement on Tuesday evening, Hamas called for a ""complete halt"" to fighting in Gaza.  ""The response prioritises the interests of our Palestinian people and emphasises the necessity of a complete halt to the ongoing aggression on Gaza,"" Hamas and the PIJ said.  The groups added that they were ready ""to engage positively to reach an agreement that ends this war"". White House national security spokesperson John Kirby said it was ""helpful"" that Hamas had submitted a response and that US officials were ""evaluating"" the group's requests.  Earlier on Tuesday US Secretary of State Antony Blinken said Israeli Prime Minister Benjamin Netanyahu had ""reaffirmed his commitment"" to the Gaza ceasefire plan and  the world was waiting for the Hamas response . The proposal set out by President Biden last month involves an initial six-week ceasefire, with Hamas releasing some hostages in exchange for Israel releasing an undefined number of Palestinian prisoners. A second phase would see the remaining hostages released by Hamas and a total withdrawal of Israeli forces from Gaza as part of a “permanent” ceasefire, but the latter would still be subject to negotiations. The actual Israeli proposal - reportedly lengthier than the summary presented by Mr Biden - has not been made public and it is unclear whether it varies from what the president conveyed in his statement on 31 May. It was presented to Hamas days prior to Mr Biden's speech. Mr Netanyahu has acknowledged his war cabinet has authorised the plan but has not voiced unequivocal support for it. Far right members of his cabinet have threatened to quit his coalition and trigger its collapse if the deal goes forward, seeing it as surrender to Hamas. As Mr Blinken met Israeli officials in Tel Aviv on Tuesday, protesters outside his hotel held American flags calling for an agreement. Many held pictures of hostages and chanted: ""SOS, USA"", and ""we trust you, Blinken, seal a deal"". Vicki Cohen, the mother of Nimrod Cohen, 19, an Israeli soldier who was kidnapped by Hamas on 7 October, held a banner showing his picture. She told the BBC: ""We come here to ask Blinken and the USA government to help us, to save us from our government. Our prime minister doesn't want to bring our loved ones back, we need their help to pressure our government."" He then travelled to the Dead Sea for a conference of Arab leaders calling for greater aid access into Gaza, where he said Israel ""can do more"". He also announced $404 million in new aid for Palestinians, urging other countries to also ""step up"" assistance. The war began after Hamas attacked Israel on 7 October, killing about 1,200 people and taking 251 others back to Gaza as hostages. The Hamas-run health ministry in Gaza says more than 37,000 people have been killed in the Israeli offensive since then."
